smartctl 6.5 2016-01-24 r4214 [x86_64-linux-4.8.0-56-generic] (local build)
Copyright (C) 2002-16, Bruce Allen, Christian Franke, www.smartmontools.org

=== START OF INFORMATION SECTION ===
Model Family:     SanDisk based SSDs
Device Model:     SanDisk SSD i100 24GB
Serial Number:    130100137481
LU WWN Device Id: 5 001b44 956278a09
Firmware Version: 11.56.02
User Capacity:    24,015,495,168 bytes [24.0 GB]
Sector Size:      512 bytes logical/physical
Rotation Rate:    Solid State Device
Form Factor:      1.8 inches
Device is:        In smartctl database [for details use: -P show]
ATA Version is:   ACS-2 T13/2015-D revision 3
SATA Version is:  SATA 3.0, 6.0 Gb/s (current: 6.0 Gb/s)
Local Time is:    Mon Nov  6 19:53:16 2017 PST
SMART support is: Available - device has SMART capability.
SMART support is: Enabled

=== START OF READ SMART DATA SECTION ===
SMART overall-health self-assessment test result: PASSED

General SMART Values:
Offline data collection status:  (0x00)	Offline data collection activity
					was never started.
					Auto Offline Data Collection: Disabled.
Self-test execution status:      (   0)	The previous self-test routine completed
					without error or no self-test has ever 
					been run.
Total time to complete Offline 
data collection: 		(  120) seconds.
Offline data collection
capabilities: 			 (0x51) SMART execute Offline immediate.
					No Auto Offline data collection support.
					Suspend Offline collection upon new
					command.
					No Offline surface scan supported.
					Self-test supported.
					No Conveyance Self-test supported.
					Selective Self-test supported.
SMART capabilities:            (0x0003)	Saves SMART data before entering
					power-saving mode.
					Supports SMART auto save timer.
Error logging capability:        (0x01)	Error logging supported.
					General Purpose Logging supported.
Short self-test routine 
recommended polling time: 	 (   2) minutes.
Extended self-test routine
recommended polling time: 	 (   7) minutes.

SMART Attributes Data Structure revision number: 1
Vendor Specific SMART Attributes with Thresholds:
ID# ATTRIBUTE_NAME          FLAG     VALUE WORST THRESH TYPE      UPDATED  WHEN_FAILED RAW_VALUE
  5 Reallocated_Sector_Ct   0x0002   100   100   000    Old_age   Always       -       0
  9 Power_On_Hours          0x0002   100   100   000    Old_age   Always       -       20544
 12 Power_Cycle_Count       0x0002   100   100   000    Old_age   Always       -       2457
171 Program_Fail_Count      0x0002   100   100   000    Old_age   Always       -       0
172 Erase_Fail_Count        0x0002   100   100   000    Old_age   Always       -       0
173 Avg_Write/Erase_Count   0x0002   100   100   000    Old_age   Always       -       22
174 Unexpect_Power_Loss_Ct  0x0002   100   100   000    Old_age   Always       -       82
187 Reported_Uncorrect      0x0002   100   100   000    Old_age   Always       -       0
230 Perc_Write/Erase_Count  0x0002   100   100   000    Old_age   Always       -       73
232 Perc_Avail_Resrvd_Space 0x0003   100   100   005    Pre-fail  Always       -       0
234 Perc_Write/Erase_Ct_BC  0x0002   100   100   000    Old_age   Always       -       42
241 Total_LBAs_Written      0x0002   100   100   000    Old_age   Always       -       487654952
242 Total_LBAs_Read         0x0002   100   100   000    Old_age   Always       -       119868070

SMART Error Log Version: 1
No Errors Logged

SMART Self-test log structure revision number 1
No self-tests have been logged.  [To run self-tests, use: smartctl -t]

SMART Selective self-test log data structure revision number 1
 SPAN  MIN_LBA  MAX_LBA  CURRENT_TEST_STATUS
    1        0        0  Not_testing
    2        0        0  Not_testing
    3        0        0  Not_testing
    4        0        0  Not_testing
    5        0        0  Not_testing
Selective self-test flags (0x0):
  After scanning selected spans, do NOT read-scan remainder of disk.
If Selective self-test is pending on power-up, resume after 0 minute delay.

