smartctl 6.4 2015-06-04 r4109 [x86_64-linux-3.18.25-std471-amd64] (local build)
Copyright (C) 2002-15, Bruce Allen, Christian Franke, www.smartmontools.org

=== START OF INFORMATION SECTION ===
Model Family:     Maxtor DiamondMax Plus 40 (Ultra ATA 66 and Ultra ATA 100)
Device Model:     Maxtor 51024U2
Serial Number:    K20L4GSC
Firmware Version: DA620XS0
User Capacity:    10,245,537,792 bytes [10.2 GB]
Sector Size:      512 bytes logical/physical
Device is:        In smartctl database [for details use: -P show]
ATA Version is:   ATA/ATAPI-5, ATA/ATAPI-4 T13/1153D revision 17
Local Time is:    Sat Mar 10 16:58:13 2018 UTC
SMART support is: Available - device has SMART capability.
SMART support is: Enabled

=== START OF READ SMART DATA SECTION ===
SMART overall-health self-assessment test result: PASSED

General SMART Values:
Offline data collection status:  (0x00)	Offline data collection activity
					was never started.
					Auto Offline Data Collection: Disabled.
Self-test execution status:      (   0)	The previous self-test routine completed
					without error or no self-test has ever 
					been run.
Total time to complete Offline 
data collection: 		(    0) seconds.
Offline data collection
capabilities: 			 (0x1b) SMART execute Offline immediate.
					Auto Offline data collection on/off support.
					Suspend Offline collection upon new
					command.
					Offline surface scan supported.
					Self-test supported.
					No Conveyance Self-test supported.
					No Selective Self-test supported.
SMART capabilities:            (0x0003)	Saves SMART data before entering
					power-saving mode.
					Supports SMART auto save timer.
Error logging capability:        (0x01)	Error logging supported.
					No General Purpose Logging support.
Short self-test routine 
recommended polling time: 	 (   2) minutes.
Extended self-test routine
recommended polling time: 	 (   8) minutes.

SMART Attributes Data Structure revision number: 16
Vendor Specific SMART Attributes with Thresholds:
ID# ATTRIBUTE_NAME          FLAG     VALUE WORST THRESH TYPE      UPDATED  WHEN_FAILED RAW_VALUE
  1 Raw_Read_Error_Rate     0x000a   253   252   000    Old_age   Always       -       605590697139
  3 Spin_Up_Time            0x0027   232   232   063    Pre-fail  Always       -       44
  4 Start_Stop_Count        0x0032   253   253   000    Old_age   Always       -       44
  5 Reallocated_Sector_Ct   0x0033   253   253   063    Pre-fail  Always       -       0
  6 Read_Channel_Margin     0x0001   253   253   100    Pre-fail  Offline      -       0
  7 Seek_Error_Rate         0x000a   253   252   000    Old_age   Always       -       97474
  8 Seek_Time_Performance   0x0027   253   249   187    Pre-fail  Always       -       218729799548216
  9 Power_On_Minutes        0x0032   253   253   000    Old_age   Always       -       6h+38m
 10 Spin_Retry_Count        0x002b   253   252   223    Pre-fail  Always       -       44
 11 Calibration_Retry_Count 0x002b   253   252   223    Pre-fail  Always       -       58
 12 Power_Cycle_Count       0x0032   242   242   000    Old_age   Always       -       4504
196 Reallocated_Event_Count 0x0012   253   253   000    Old_age   Always       -       0
197 Current_Pending_Sector  0x0010   253   253   000    Old_age   Offline      -       0
198 Offline_Uncorrectable   0x0012   253   253   000    Old_age   Always       -       0
199 UDMA_CRC_Error_Count    0x0008   199   199   000    Old_age   Offline      -       0
200 Multi_Zone_Error_Rate   0x000a   253   252   000    Old_age   Always       -       253425
201 Soft_Read_Error_Rate    0x000a   253   252   000    Old_age   Always       -       30065079475
202 Data_Address_Mark_Errs  0x000a   253   252   000    Old_age   Always       -       308403
203 Run_Out_Cancel          0x000a   253   252   180    Old_age   Always       -       12885210291
204 Soft_ECC_Correction     0x000a   253   252   000    Old_age   Always       -       308403
205 Thermal_Asperity_Rate   0x000a   253   252   000    Old_age   Always       -       308403
207 Spin_High_Current       0x002a   253   252   000    Old_age   Always       -       44
208 Spin_Buzz               0x002a   253   252   000    Old_age   Always       -       44
209 Offline_Seek_Performnce 0x0024   253   253   000    Old_age   Offline      -       0
 96 Unknown_Attribute       0x0004   253   253   000    Old_age   Offline      -       0
 97 Unknown_Attribute       0x0004   253   253   000    Old_age   Offline      -       0
 98 Unknown_Attribute       0x0004   253   253   000    Old_age   Offline      -       0
 99 Unknown_Attribute       0x0004   253   253   000    Old_age   Offline      -       0
100 Unknown_Attribute       0x0004   253   253   000    Old_age   Offline      -       0
101 Unknown_Attribute       0x0004   253   253   000    Old_age   Offline      -       0

SMART Error Log Version: 1
Warning: ATA error count 10348 inconsistent with error log pointer 5

ATA Error Count: 10348 (device log contains only the most recent five errors)
	CR = Command Register [HEX]
	FR = Features Register [HEX]
	SC = Sector Count Register [HEX]
	SN = Sector Number Register [HEX]
	CL = Cylinder Low Register [HEX]
	CH = Cylinder High Register [HEX]
	DH = Device/Head Register [HEX]
	DC = Device Command Register [HEX]
	ER = Error register [HEX]
	ST = Status register [HEX]
Powered_Up_Time is measured from power on, and printed as
DDd+hh:mm:SS.sss where DD=days, hh=hours, mm=minutes,
SS=sec, and sss=millisec. It "wraps" after 49.710 days.

Error 10348 occurred at disk power-on lifetime: 6 hours (0 days + 6 hours)
  When the command that caused the error occurred, the device was in an unknown state.

  After command completion occurred, registers were:
  ER ST SC SN CL CH DH
  -- -- -- -- -- -- --
  84 51 00 00 00 00 50  Error: ABRT

  Commands leading to the command that caused the error were:
  CR FR SC SN CL CH DH DC   Powered_Up_Time  Command/Feature_Name
  -- -- -- -- -- -- -- --  ----------------  --------------------
  ef 02 00 01 00 00 10 02      00:20:50.176  SET FEATURES [Enable write cache]
  ef aa 00 01 00 00 10 02      00:20:50.176  SET FEATURES [Enable read look-ahead]
  ef 03 44 00 00 00 10 02      00:20:50.176  SET FEATURES [Set transfer mode]
  ef 03 0c 00 00 00 10 02      00:20:50.176  SET FEATURES [Set transfer mode]

Error 10347 occurred at disk power-on lifetime: 6 hours (0 days + 6 hours)
  When the command that caused the error occurred, the device was in an unknown state.

  After command completion occurred, registers were:
  ER ST SC SN CL CH DH
  -- -- -- -- -- -- --
  84 51 00 00 00 00 00  Error: ABRT

  Commands leading to the command that caused the error were:
  CR FR SC SN CL CH DH DC   Powered_Up_Time  Command/Feature_Name
  -- -- -- -- -- -- -- --  ----------------  --------------------
  ef 02 00 01 00 00 10 00      00:21:34.800  SET FEATURES [Enable write cache]
  ef aa 00 01 00 00 10 00      00:21:34.768  SET FEATURES [Enable read look-ahead]
  ef 03 44 00 00 00 10 00      00:21:34.736  SET FEATURES [Set transfer mode]
  ef 03 0c 00 00 00 10 00      00:21:34.704  SET FEATURES [Set transfer mode]
  ec 00 00 01 00 00 10 00      00:21:34.656  IDENTIFY DEVICE

Error 10346 occurred at disk power-on lifetime: 6 hours (0 days + 6 hours)
  When the command that caused the error occurred, the device was in an unknown state.

  After command completion occurred, registers were:
  ER ST SC SN CL CH DH
  -- -- -- -- -- -- --
  84 51 00 00 00 00 50  Error: ABRT

  Commands leading to the command that caused the error were:
  CR FR SC SN CL CH DH DC   Powered_Up_Time  Command/Feature_Name
  -- -- -- -- -- -- -- --  ----------------  --------------------
  ef 02 00 01 00 00 10 02      00:14:15.712  SET FEATURES [Enable write cache]
  ef aa 00 01 00 00 10 02      00:14:15.712  SET FEATURES [Enable read look-ahead]
  ef 03 44 00 00 00 10 02      00:14:15.712  SET FEATURES [Set transfer mode]
  ef 03 0c 00 00 00 10 02      00:14:15.712  SET FEATURES [Set transfer mode]

Error 10345 occurred at disk power-on lifetime: 6 hours (0 days + 6 hours)
  When the command that caused the error occurred, the device was in an unknown state.

  After command completion occurred, registers were:
  ER ST SC SN CL CH DH
  -- -- -- -- -- -- --
  84 51 00 00 00 00 00  Error: ABRT

  Commands leading to the command that caused the error were:
  CR FR SC SN CL CH DH DC   Powered_Up_Time  Command/Feature_Name
  -- -- -- -- -- -- -- --  ----------------  --------------------
  ef 02 00 01 00 00 10 00      00:13:55.264  SET FEATURES [Enable write cache]
  ef aa 00 01 00 00 10 00      00:13:55.248  SET FEATURES [Enable read look-ahead]
  ef 03 44 00 00 00 10 00      00:13:55.232  SET FEATURES [Set transfer mode]
  ef 03 0c 00 00 00 10 00      00:13:55.232  SET FEATURES [Set transfer mode]
  ec 00 00 01 00 00 10 00      00:13:55.216  IDENTIFY DEVICE

Error 10344 occurred at disk power-on lifetime: 6 hours (0 days + 6 hours)
  When the command that caused the error occurred, the device was in an unknown state.

  After command completion occurred, registers were:
  ER ST SC SN CL CH DH
  -- -- -- -- -- -- --
  84 51 00 00 00 00 50  Error: ABRT

  Commands leading to the command that caused the error were:
  CR FR SC SN CL CH DH DC   Powered_Up_Time  Command/Feature_Name
  -- -- -- -- -- -- -- --  ----------------  --------------------
  ef 02 00 01 00 00 10 02      00:01:10.592  SET FEATURES [Enable write cache]
  ef aa 00 01 00 00 10 02      00:01:10.592  SET FEATURES [Enable read look-ahead]
  ef 03 44 00 00 00 10 02      00:01:10.592  SET FEATURES [Set transfer mode]

SMART Self-test log structure revision number 1
No self-tests have been logged.  [To run self-tests, use: smartctl -t]

Selective Self-tests/Logging not supported

